Link,Title
https://www.fool.com/investing/2020/09/08/why-solar-stocks-jumped-double-digits-in-august/?source=eptyholnk0000202&utm_source=yahoo-host&utm_medium=feed&utm_campaign=article&yptr=yahoo,Why Solar Stocks Jumped Double Digits in August
https://www.fool.com/investing/2020/09/04/why-solar-power-stocks-are-crashing-again-friday/?source=eptyholnk0000202&utm_source=yahoo-host&utm_medium=feed&utm_campaign=article&yptr=yahoo,Why Solar Power Stocks Are Crashing Again Friday
https://www.fool.com/investing/2020/09/03/why-solar-power-stocks-are-crashing-thursday/?source=eptyholnk0000202&utm_source=yahoo-host&utm_medium=feed&utm_campaign=article&yptr=yahoo,Why Solar Power Stocks Are Crashing Thursday
https://www.barrons.com/articles/green-energy-shares-rise-along-with-joe-bidens-polling-51598029084?siteid=yhoof2&yptr=yahoo,Green-Energy Shares Rise Along With Joe Biden’s Polling
https://finance.yahoo.com/news/sunrun-grid-alternatives-free-home-130000621.html,Sunrun and GRID Alternatives to Provide Free Home Batteries to Eligible Californians who are Vulnerable to Power Outages
https://www.fool.com/investing/2020/08/20/is-sunrun-sunpower-right-future-residential-solar/?source=eptyholnk0000202&utm_source=yahoo-host&utm_medium=feed&utm_campaign=article&yptr=yahoo,Is Sunrun or SunPower Right About the Future of Residential Solar?
https://finance.yahoo.com/news/sunrun-vivint-solar-announce-stock-110000835.html,"Sunrun, Vivint Solar Announce Stock Purchase Agreement Between Coatue and Blackstone Affiliate"
https://www.thestreet.com/investing/stocks/5-stock-gainers-for-wednesday-tesla-acm-research?puc=yahoo&cm_ven=YAHOO&yptr=yahoo,"5 Stock Gainers for Wednesday: Tesla, ACM Research, Sunrun"
https://www.fool.com/investing/2020/08/11/why-plug-power-sunrun-and-vivint-solar-stocks-drop.aspx?source=eptyholnk0000202&utm_source=yahoo-host&utm_medium=feed&utm_campaign=article&yptr=yahoo,"Why Plug Power, Sunrun, and Vivint Solar Stocks Dropped This Morning"
https://finance.yahoo.com/news/sunrun-run-reports-q2-loss-212509397.html,"Sunrun (RUN) Reports Q2 Loss, Tops Revenue Estimates"
https://finance.yahoo.com/news/sunrun-reports-second-quarter-2020-200500504.html,Sunrun Reports Second Quarter 2020 Financial Results
https://finance.yahoo.com/news/sunrun-run-gains-lags-market-215009644.html,Sunrun (RUN) Gains But Lags Market: What You Should Know
https://www.barrons.com/articles/the-covid-19-pandemic-cant-stop-the-solar-boom-51596561610?siteid=yhoof2&yptr=yahoo,The Covid-19 Pandemic Can’t Stop the Solar Boom
https://finance.yahoo.com/news/sunrun-run-earnings-expected-grow-163104869.html,Sunrun (RUN) Earnings Expected to Grow: What to Know Ahead of Next Week's Release
https://finance.yahoo.com/news/sunrun-partners-california-community-energy-130000535.html,Sunrun Partners With California Community Energy Groups to Enhance Resiliency With Local Clean Power
https://finance.yahoo.com/news/sunrun-sk-e-affiliates-form-234400385.html,"Sunrun, SK E&S and Affiliates Form Electrification Venture to Create Energy System of the Future"
https://www.fool.com/investing/2020/07/29/why-vivint-solars-shares-dropped-109-on-wednesday.aspx?source=eptyholnk0000202&utm_source=yahoo-host&utm_medium=feed&utm_campaign=article&yptr=yahoo,Why Vivint Solar's Shares Dropped 10.9% on Wednesday
https://www.fool.com/investing/2020/07/29/why-iaa-and-carpenter-technology-stocks-just-poppe.aspx?source=eptyholnk0000202&utm_source=yahoo-host&utm_medium=feed&utm_campaign=article&yptr=yahoo,"Why IAA and Carpenter Technology Stocks Just Popped 10%, but Sunrun Dropped"
https://finance.yahoo.com/news/sunrun-iaa-rexford-industrial-realty-224900090.html,"Sunrun, IAA & Rexford Industrial Realty Set to Join S&P MidCap 400; Bancfirst, Deluxe & Carpenter Technology to Join S&P SmallCap 600"
https://www.fool.com/investing/2020/07/24/1-thing-investors-should-watch-as-sunrun-buys-vivi.aspx?source=eptyholnk0000202&utm_source=yahoo-host&utm_medium=feed&utm_campaign=article&yptr=yahoo,1 Thing Investors Should Watch as SunRun Buys Vivint Solar
https://www.fool.com/investing/2020/07/21/how-sunrun-can-become-a-giant-in-renewable-energy.aspx?source=eptyholnk0000202&utm_source=yahoo-host&utm_medium=feed&utm_campaign=article&yptr=yahoo,How Sunrun Can Become a Giant in Renewable Energy
https://www.marketwatch.com/story/sunruns-stock-rises-toward-8th-straight-record-after-jp-morgan-boosts-price-target-to-street-high-2020-07-21?siteid=yhoof2&yptr=yahoo,SunRun's stock rises toward 8th-straight record after J.P. Morgan boosts price target to Street high
https://finance.yahoo.com/news/sunrun-announces-date-conference-call-120010336.html,Sunrun Announces Date and Conference Call Details for Second Quarter 2020 Earnings Report
https://finance.yahoo.com/news/massif-capital-2020-q2-investor-140809039.html,Massif Capital 2020 Q2 Investor Letter: We Have No Idea
https://finance.yahoo.com/news/were-hedge-funds-piling-sunrun-161914418.html,Were Hedge Funds Right About Piling Into Sunrun Inc (RUN)?
https://finance.yahoo.com/news/lifshitz-law-firm-p-c-193500445.html,"Lifshitz Law Firm, P.C. Announces Investigation of Benefytt Technologies, Inc., Delmarva Bancshares, Inc., Garrison Capital Inc., Portman Ridge Finance Corporation, Graf Industrial Corp., Invitae Corporation, Maxim Integrated Products, Analog Devices, Rexahn Pharmaceuticals, Inc., Vivint Solar, Inc. and Sunrun, Inc."
https://www.fool.com/investing/2020/07/15/why-solar-stocks-kept-climbing-tuesday.aspx?source=eptyholnk0000202&utm_source=yahoo-host&utm_medium=feed&utm_campaign=article&yptr=yahoo,Why Solar Stocks Kept Climbing Tuesday
https://www.fool.com/investing/2020/07/13/time-sensitive-why-sunrun-and-vivint-solar-stocks.aspx?source=eptyholnk0000202&utm_source=yahoo-host&utm_medium=feed&utm_campaign=article&yptr=yahoo,"Why Sunrun and Vivint Solar Stocks Rose Today, but Clean Energy Fuels Dropped"
https://www.barrons.com/articles/solar-stocks-jump-as-analyst-blesses-plan-for-merger-51594659106?siteid=yhoof2&yptr=yahoo,Solar Stocks Jump as Analyst Blesses Plan for Merger
https://finance.yahoo.com/news/4-solar-stocks-outperformed-broader-113211843.html,4 Solar Stocks That Have Outperformed the Broader Market YTD
https://finance.yahoo.com/news/sunrun-run-stock-now-150536347.html,What to Do with Sunrun (RUN) Stock Right Now?
https://finance.yahoo.com/news/zacks-analyst-blog-highlights-ameresco-145002292.html,"The Zacks Analyst Blog Highlights: Ameresco, Sunrun, Vivint Solar, Bloom Energy and SolarEdge Technologies"
https://finance.yahoo.com/news/sunrun-run-catches-eye-stock-125612667.html,Sunrun (RUN) Catches Eye: Stock Jumps 8%
https://finance.yahoo.com/news/rooftop-revolution-coronavirus-chill-upends-061817130.html,Rooftop revolution: Coronavirus chill upends solar power industry
https://finance.yahoo.com/news/makes-sunrun-run-strong-momentum-160004186.html,What Makes Sunrun (RUN) a Strong Momentum Stock: Buy Now?
https://finance.yahoo.com/news/shareholder-alert-levi-korsinsky-llp-144500607.html,"SHAREHOLDER ALERT: Levi & Korsinsky, LLP Notifies Investors of an Investigation Regarding Whether the Merger of Sunrun Inc. with Vivint Solar, Inc. is Fair to RUN Shareholders"
https://www.fool.com/investing/2020/07/08/what-you-need-to-know-about-sunruns-acquisition-of.aspx?source=eptyholnk0000202&utm_source=yahoo-host&utm_medium=feed&utm_campaign=article&yptr=yahoo,What You Need to Know About Sunrun's Acquisition of Vivint Solar
https://www.barrons.com/articles/netflix-closes-at-record-high-51594198801?siteid=yhoof2&yptr=yahoo,"The VIX Hits 29, and Two More Numbers to Know"
https://finance.yahoo.com/news/shareholder-alert-weisslaw-llp-investigates-013000252.html,"SHAREHOLDER ALERT: WeissLaw LLP Investigates Vivint Solar, Inc."
https://finance.yahoo.com/news/shareholder-notice-brodsky-smith-llc-224000883.html,"SHAREHOLDER NOTICE: Brodsky & Smith, LLC Announces an Investigation of Vivint Solar, Inc. (NYSE - VSLR)"
https://www.fool.com/investing/2020/07/07/why-sunrun-and-vivint-solar-stocks-soared-today.aspx?source=eptyholnk0000202&utm_source=yahoo-host&utm_medium=feed&utm_campaign=article&yptr=yahoo,Why Sunrun and Vivint Solar Stocks Soared Today
https://finance.yahoo.com/news/oil-prices-range-bound-pipelines-190000973.html,Oil Prices Range Bound As Pipelines Come Under Pressure
https://techcrunch.com/2020/07/07/sunruns-3-2-billion-vivint-solar-bid-challenges-teslas-energy-ambitions/,Sunrun's $3.2 billion Vivint Solar bid challenges Tesla's energy ambitions
https://www.marketwatch.com/story/sunrun-stock-jumps-more-than-25-after-deal-news-2020-07-07?siteid=yhoof2&yptr=yahoo,Sunrun stock jumps more than 25% after deal news
https://www.barrons.com/articles/sunrun-stock-solar-merger-profitability-california-residential-51594138644?siteid=yhoof2&yptr=yahoo,Solar Stocks Are Jumping Because a Merger Could Bring Profitability
https://finance.yahoo.com/news/clean-energy-etfs-focus-sunrun-160504946.html,Clean Energy ETFs in Focus on Sunrun-Vivint Solar Deal
https://finance.yahoo.com/news/sunrun-set-buy-vivint-solar-145302944.html,Sunrun Set to Buy Vivint Solar for $3.2B in an All-Stock Deal
https://www.fool.com/investing/2020/07/07/sunrun-consolidates-solar-panel-market-with-vivint.aspx?source=eptyholnk0000202&utm_source=yahoo-host&utm_medium=feed&utm_campaign=article&yptr=yahoo,Sunrun Consolidates the Residential Solar Market With Vivint Solar Acquisition
https://www.thestreet.com/investing/sunrun-run-stock-vivint-solar-vslr-acquisition?puc=yahoo&cm_ven=YAHOO&yptr=yahoo,Sunrun to Buy Solar Peer Vivint Solar for $1.46 Billion in Stock
https://finance.yahoo.com/news/vslr-alert-johnson-fistel-investigates-132600342.html,(VSLR) Alert: Johnson Fistel Investigates Proposed Sale of Vivint Solar; Are Shareholders Getting a Fair Deal?
